10/21/2021 16:26:25,D2-1,"Racism has been a big problem and controversial issue in America for a long time. American society has been historically unequal and discriminatory, and structural racism is reproduced over time. It should not be unknown to us how people other than white complexion have been and are still being treated. We have failed as a society. Racism still exists between us and somehow reproduces over time. People believing in race superiority has been promoting their agenda. Historically America has always prefered white people over any other skin color and always violated black or brown people rights. American cops have been unrightfully arrested and accused black people with charges for the crimes they haven't even done. They created an image of black people as a negative member of their society and have always violated and discriminated against them. Now when AI technology like PredPol uses previous crime data, which was completely against black people. It targets more black people and thus in a way creating more racism.","Racial biases have built into society creating hurdles in education, politics and social structures. This created many obstacles for minorities that hindered them. A way to address this would be by readdressing and reforming the Education system in america. For politics I would change policies that are backed by racist beliefs.","  I believe that when referring to the police arresting individuals in areas that they were looking for crime it makes sense. This is because they believe they will find more crime although that is a biased thought and it is partially due to our society embedding the idea that more crime occurs in areas that are majority black..One way that I would address to fix this issue would be to have an equal amount of cops patrolling in each area that their station is responsible for. If a certain area does legitimately report more crimes under those circumstances, then perhaps that data would be less biased", You could change the fact that an algorithm's developer chose proxy variables that had racial bias by having that data changed or removed for having racial bias. If this bias is removed then it is far less likely for algorithms to act in a racially biased way as it is trained in a more fair way. This problem could also be addressed by trying to use another algorithm to detect if racial bias played a significant role in the decision. If the decision was likely made in large part due to racial bias then that is when a person can review it and make the correct decision. ,10,35,35,20,"
Due to the large amount of resources that is needed to solve this problem, our group believes that 100 Billion USD is not a sufficient amount. One reason we believe this is due to the fact that the operating cost for policing nationally alone is 115 Billion USD. 500 Billion would be an appropriate amount perhaps even more funding may be needed in the future. We would allocate the majority of the funding into Structural because we believe that starting from the bottom is the solution. This means changing the way education is approached, politics, and jobs. 
"
10/21/2021 16:28:44,D2-2,"To address the fact American society has been unequal and discriminatory, you must first acknowledge it. Once you realize it has always been historically present, you can then understand the fact that it is structurally reproduced overtime. Since it has always been present, it was able to build itself up and set up almost a hierarchy. Changing this would require years and years of advocacy for the rights of the discriminated, to undo centuries of brainwashing.  This could be done through proper education, as well as campaigns to spread awareness of structural racism.","Structural racism is reproduced over time because individuals at a disadvantage due to these structures have trouble escaping conditions like poverty because people born into poverty will have a harder time escaping it due to a lack of opportunities and advantages. . Once you know the history it is easy to figure out why it is built in our society at a structural level. Parents teach their kids, who teach their kids and so on. This could be solved by increasing the quality of education in impoverished areas. Increasing the quality of education would allow people born in lower income areas to get better jobs through a better education.  ","The fact that people who made the underlying decisions did so in a racially biased way is because some people still have the superior attitude, or they didn’t care enough to make sure that systems are unbiased. This can be corrected by holding the police more accountable for racial profiling whether intentional or unintentional. ",A way we could address this is by giving the system a more diverse test and see if the system is racist or not. The more diverse the tests are the less discriminatory it will be and then release the algorithm once you feel it's no longer racially biased.,10000000000,40000000000,30000000000,20000000000,"100 billion is more than enough. It will allow us to kickstart this project and get it up and running as soon as possible.  The majority of extra funding would have to go to the structural aspect because we are funding the education of certain areas. Raising awareness is not as costly as supplying schools, hiring teachers ect."
10/21/2021 16:33:26,D2-2,"To address the fact American society has been unequal and discriminatory, you must first acknowledge it. Once you realize it has always been historically present, you can then understand the fact that it is structurally reproduced overtime. Since it has always been present, it was able to build itself up and set up almost a hierarchy. Changing this would require years and years of advocacy for the rights of the discriminated, to undo centuries of brainwashing.  This could be done through proper education, as well as campaigns to spread awareness of structural racism.","Structural racism is reproduced over time because individuals at a disadvantage due to these structures have trouble escaping conditions like poverty because people born into poverty will have a harder time escaping it due to a lack of opportunities and advantages. . Once you know the history it is easy to figure out why it is built in our society at a structural level. Parents teach their kids, who teach their kids and so on. This could be solved by increasing the quality of education in impoverished areas. Increasing the quality of education would allow people born in lower income areas to get better jobs through a better education.  ","The fact that people who made the underlying decisions did so in a racially biased way is because some people still have the superior attitude, or they didn’t care enough to make sure that systems are unbiased. This can be corrected by holding the police more accountable for racial profiling whether intentional or unintentional. ",A way we could address this is by giving the system a more diverse test and see if the system is racist or not. The more diverse the tests are the less discriminatory it will be and then release the algorithm once you feel it's no longer racially biased.,10000000000,40000000000,30000000000,20000000000,"100 billion is more than enough. It will allow us to kickstart this project and get it up and running as soon as possible.  The majority of extra funding would have to go to the structural aspect because we are funding the education of certain areas. Raising awareness is not as costly as supplying schools, hiring teachers ect."
10/21/2021 16:38:39,D2-3,Identify the causes of structural inequalities throughout history and break the cycle of institutional racism so these problems can be quashed before it becomes a truly impossible project. Right wrongdoings and utilize legislation to safeguard against racism in our society.,"showing history related to current events, such as the time when black migrants would migrate for safety yet still get persecuted by police and other white men as it is similar to now where people of color need to record themselves when pulled over for safety and to change this the best thing to do would be to teach them from a young age the importance of a human being, and how one shouldn't be defined by their color. Another way to address/change this would be to see the algorithm where crime has constantly happened more against people of color than others and decide that it is time to take a step forward and stop what is happening by placing more people of color into high job positions so that the structure doesn't matter anymore. Any potential challenges that may arrive, you can tackle them by using a logical standpoint where you could talk about the benefits of a better society by having everyone be on equal terms","Make the underlying decision that these companies make completely transparent to the public. Nowadays, society and social media has increasingly been more impactful on the actions of companies and regulations. If there are racially targeting action being done, then they will face the full repercussions from the public. Another thing that can be done is having a large diverse group of people judging the decision being made by the company and they take action and regulate the ethics of that company. ","Rather than using past arrest data, create an entirely new data set to isolate the algorithm from bias integrated into society. Without the data from overpoliced black communities and arguably underpoliced white ones, instead using unbiased (to the best of human ability) points from a closely monitored sample, the algorithm can become less racist. The set could possibly come from equally distributing policing by pure population and monitoring arrests, taking care to follow strict rules to avoid racist bias. Holding the police accountable entirely for actions deemed outside the law, so that acting purely on preconceived notions and what might be thought of as ""past experience"" with a race can be held back, arrests being made on the doctrine of law and law only.",15,40,10,35,"100 billion USD is nowhere near enough funding to address the boundless problem of racial bias and inequality in society. The US government spends hundreds of billions more per year on healthcare, defense, and many other programs which still struggle to make a lasting impact of help in society. Billions if not trillions more would be needed to truly enact eternal structural change, fighting against income inequality and centuries of bias. The most important of the 4 categories above is structural, because it directly influences the human aspect more, and by proxy, algorithms like PredPol. Historical change, while important as ever, is slower and farther removed from the core of the problem."
10/22/2021 14:24:11,D3-3,Two possible solutions: We can come up with a social and educational reform.,"Implement government policies that deconstruct out current structures in policing and rebuild them as bias free as possible. While this is a taxing and long process, I think it may be the best course of action for removing those biases from our society. If we continue to use the structures that were built on racial bias, we are propping up that bias and allowing it to continue to reproduce itself within our daily world.","Make sure the group of people making the underlying decisions in policing is diverse and reprasentative of the population who will be affected by the algorithms output/predictions. This way, marginalized groups have a say in the decisions, and the chances of making racially biased ones will decrease as a result.","Create a layered screening process that makes sure the policing data is representative racially, geographically, socio-economically, and looks for/notes patterns that may be a result of past or current racial bias. Put the proxy variable through this process before bringing it into the algorithm.",20,40,10,30,"The poor spending habits of the United States demonstrates that 100 Billion is not enough and this will need constant funding. The amount of debt that has built up is proof, who is to say that inflation will not affect this program. The United States introduce slavery back in the 1800, and the discrimination against those of color still exists today. In order to have a reform, this will take time and money. Constant funding is key."
10/22/2021 14:25:15,D3-4,Another way we could work to get rid of the historically racist america is to make sure in schooling even from the youngest levels that kids are taught to be anti racists and especially country wide. Many places (the south) still intentionally teach some racist ideals just because the culture is still often unfortunately like that in more rural areas of the country where society hasn't caught up to the rest of the country. ,"We need to reconstruct the policing system. Use a small sample size of cities that use a different policing system and see how well it works. If it does work, slowly start spreading it to bigger cities and see how well it works there. If that works, spread it everywhere else. If either of these fail, create a new system and start over.",This is the hardest one to change as these kinds of decisions aren't always obviously or even apparently racist as these are small decisions that may not immediately have a huge impact. In order to change or address these we need to remove people who have been making these decisions from whatever positions they may be in. This may seem harsh especially for small things but this would inspire the idea of anti racism. ,"A bigger sample size like posts from social media like Instagram would be a better sample size, then getting data from smaller apps like the Facial recognition video. It has a larger data set with alot of diversity.",35,30,10,25,"No, this is because two of our solutions are reframing both the education system and the policing system and these two things alone would probably take up way more than the 100 billion dollar budget. The education system by itself would potentially be a trillion dollar change as you would have to change things like some teachers, rewrite the standardized books , and even reform the governing bodies that control the schooling per state and at a national level. "
10/22/2021 14:28:38,D3-2,"We should have programs in school for teaching young and impressionable kids about the past and how racist it is. Then, we can have these programs convert them to be anti-racist so that way they can build a society that is not racist.","Another option is to make the core parts of society easier, making the system so everyone and anyone are able to instantly adapt to society's standards and live without too much hardship. This will change class systems where one person with a higher position will never look down or underestimate the lower positioned people and see eye to eye that they are equal.","It's best not to underestimate people and the issues where it's common for 3 out of 5 people employed in a low-class job are one of those things that allow people to change the way they think. And this is what it takes for them to make these decisions, underestimating those under them in profession, economic, political, or financial standing. To fix this society needs to structure these aspects in a way that it is accessible to everyone.","To change this we need to identify the variables that will certainly lead to racial bias, and after identifying these variables, the developers will work around and use data that does not target anything specific other than raw data. Developers must make sure the algorithm is structured in a way so that the system won't make any assumptions based on specific types of people, instead only on raw data and variables given to it.",30000000000,30000000000,20000000000,20000000000,"100 billion would not be nearly enough to address the fundamental problem of racism in our society because it will continue so long as the idea of race exists. No matter how much we change, there will always be these few people that would come together and be biased against a certain race. However, if we were to consider how much budget maybe the net worth of the US so that we may continuously fund our project so that it will continue to root out racism in our system. 
We think the categories that would allocate the most resource would either be history or structure, as they fixate on building education or helping those that are unemployed in some way.
"
10/22/2021 14:32:41,D3-1,Question 1 : We would change the way that police officers have to get trained in order to get their occupation. The new training would make sure that nobody works in law enforcement before they are mostly likely not racist.   Question 2 : We would add more black history into the school's educational system and raise more awareness about all the racism black people still have to face up until this day.,Question 3: We would teach kids at such an early age to coexist more with people that don't look as similar to themselves this way the difference of skin wouldn't trigger any racial biases.  Question 4: We would try to make people more conscious about all the racial biases and discriminations they might have done subconsciously by giving them examples and revealing to them where the problem is at.,Question 5 : We would address that problem through making sure that it doesn't happen again through developing an algorithm that can spot the real intention of the people behind these decisions.  Question 6 :	We would avoid that from ever happening again through hiring more people that are black/from marginalized communities this way the underlying decisions are less likely to be done so in a racially biased way.,"Question 7: We would first try to find the proxy variable used in the algorithm and try to develop a more objective and less racially biased algorithm that does the exact same job the first one was given.  Question 8 : We would try to raise people's awareness about the fact that the algorithm isn't as objective as we might think it is, this way more human resources would be relied on instead of just algorithms.",20,20,30,30,"Yes it is enough money to address the problem we are seeking to solve because if one of the biggest cities in the whole world is run for around that amount, if it was all smartly used to combat racism it would be enough."
10/22/2021 14:39:02,D3-5,"We can introduce more curriculum(s) in secondary schools that go into more depth about the history of racism. Changing secondary curriculum educates a larger population of people, as most people don’t attend post secondary school.  (cost: 1.6 billion per curriculum) (spend 8 billion for 5 curriculums, assume we are adding more than one as there are multiple facets to racism)  We can include/fund more research in structural racism to break down and look into more data and history to update old curriculums. (cost: $100,000 per research, additional 1.6 billion to replace/reform old curriculums)","People can form commutative groups to help solve the problems of racism they face in their community. This will also help people understand different points of views for each other. The fund will be 15 billion for specific resources needed for people to express their opinions and for communities to be accepted by one another. (implemented in spaces like college, funds to help with these programs/clubs)","We could use the money to set up funds in the form of foundations, college tuition, etc. to help people who were affected by racism and for communities that have faced adversity due to history.",We will stop and limit the use of algorithms that  have a racist bias by blocking the way in which the proxies are created. If there is a set of common code or if there is a common technique used to tell this specific proxy to prefer one race to another than we will decode it and shut it down we will do this by  starting an organization that’s only job is to search the web for proxies and codes that are created to be racist but our group will also shut the server down and block that specific coding from being used again by a another server. (cost: 15billion) ,15000000000,15000000000,30000000000,40000000000,I believe no amount of money will solve this problem completely! But an additional 50 billion will help decrease the amount of racism people deal with . I think the extra  50 billion should go straight to technology because we live in a world where technology runs everything and to reach many people in a more efficient way to help end this problem we must add extra money to the technology category.
10/22/2021 15:38:21,D4-5,"One way that you can change the fact that ""American society has been historically unequal and discriminatory, and structural racism is reproduced over time"" is by destroying all stereotypes when it comes to job titles, crime rates, and everyday life. For example, the idea that jobs like nurses and secretaries are to be done by women should be dismantled in our society. This would help get rid of premeditated negative connotations of certain groups of people. A way to get rid of these stereotypes would be to up the employment rate of the other gender/races in these jobs that are dominated by one gender or race. Also, we need to educate people on the idea that anyone can do any job. ","We need to realize the huge impact zoning laws and redlining of areas had on people of colour and that we need to work on changing it. For instance, zoning laws can be used as an incentive for people to invest into building diverse communities, and trying to ensure that low income housing can be affordable. This is so people who rent can instead become homeowners and thus have a more active involvement in the economy of the country. By incentivising diverse communities to be built, a more diverse group would have access to utilities in areas that are already developed, while affordable housing would promote the better access of utilities like libraries and parks in low income areas.","We can raise public awareness of racial bias by spreading it on the news and social media that the people who made these underlying decisions did so in a racially biased way, as kind of like a shame method. This will most likely shame and embarrass them into making a change. Some challenges that might occur is more protesting and fighting against the police force, but hopefully the people can realize the whole algorithm is the problem because it was made in a racially biased way","To change the fact that ""the algorithm developers chose a proxy variable that had racial bias"", we need to have people double checking the proxy variable that is used. The algorithm developers might not be conscious that they are making racially biased decisions. Therefore, to make sure that it doesn't happen, we need people to double check and vote on  the proxy variable that they are using. However, there are people who are going to go against that because they might think that it’s a waste of time and that there can't really be anything that could go wrong with using algorithms.",20000000000,40000000000,20000000000,20000000000,"As of right now, we think 100 billion is not enough money to address the problem we seek to solve because even $100 Billion isn’t enough for our Structural Plan, being that the federal government already spends that per year on low-income housing. With the additional programs: affecting news, labor, and high-level technology, the total will be even more. We could see $1 Trillion working."
